Content,Video title,Video publish time,Duration,Engaged views,Average view duration,Average percentage viewed (%),Stayed to watch (%),Unique viewers,Average views per viewer,New viewers,Returning viewers,Casual viewers,Regular viewers,Transaction revenue (USD),Transactions,Revenue per transaction (USD),YouTube Premium (USD),Estimated DoubleClick revenue (USD),Watch Page ads (USD),Estimated AdSense revenue (USD),YouTube ad revenue (USD),Ad impressions,Playback-based CPM (USD),CPM (USD),Estimated monetized playbacks,RPM (USD),Views,Watch time (hours),Subscribers,Estimated revenue (USD),Impressions,Impressions click-through rate (%)
Total,,,,451211,0:01:28,50.82,66.36,0,0,0,0,0,0,0,0,0,0,0,0,0,0,0,0,0,0,0,764712,11177.1433,5877,0,880470,4.06
UObM30FGdSs,The 12 Tribes origins and historical significance!  #history #biblicalexploration #history,"Feb 15, 2025",45,89216,0:01:05,146.19,70.63,,,,,,,,,,,,,,,,,,,,115243,1634.8646,1446,,99947,4.52
WpEsJWK1Awo,The Slave Ships of Deuteronomy 28 — Biblical Prophecy Fulfilled,"Mar 30, 2025",45,27591,0:01:11,159.35,72.98,,,,,,,,,,,,,,,,,,,,59920,553.7381,362,,14271,6.23
fGuiMnJQsjY,Why God Chose The Smallest Nation To Be SPECIAL? #blackhistory @AIBIBLEGOSPELS,"Mar 3, 2025",40,16605,0:01:08,171.27,77.32,,,,,,,,,,,,,,,,,,,,22300,316.2635,225,,46429,7.53
hNt6alQiIVE,The Tribe of Judah in North America — Where Are They Now?,"Apr 3, 2025",58,16009,0:01:28,152.86,75.91,,,,,,,,,,,,,,,,,,,,33316,396.3603,153,,16776,5.78
rjtM2N5MIGM,Christ Will Destroy Edom — Genesis 49 Prophecy Explained,"Apr 5, 2025",62,13473,0:01:18,126.93,79.17,,,,,,,,,,,,,,,,,,,,27022,296.0819,150,,16391,7.84
RSooE7guQxg,Noah Youngins #biblicalexploration #history #blackhistory @AIBIBLEGOSPELS,"Feb 19, 2025",37,12983,0:00:57,155.81,68.24,,,,,,,,,,,,,,,,,,,,13123,207.9222,122,,2973,2.66
H9jblXXVHxY,Where Did The Lost Tribes of Israel Really Go? #history #biblicalexploration #blackhistory,"Feb 9, 2025",38,11445,0:00:59,156.07,78.99,,,,,,,,,,,,,,,,,,,,12011,188.615,140,,13184,3.31
EWksyIbaImo,The Tribe of Zebulun and the Panama Canal — Bible Prophecy,"Apr 7, 2025",55,10531,0:01:17,140.68,71.04,,,,,,,,,,,,,,,,,,,,22270,227.9823,55,,4134,2.39
dKw6UGVQF98,Deuteronomy 28:68 — They Went Into Slavery on Ships,"Mar 28, 2025",44,9715,0:01:02,142.09,63.87,,,,,,,,,,,,,,,,,,,,19415,170.5501,72,,4366,3.21
mAJS97kNC5E,The Prophecy Reveled : Chosen 12 Tribes of Israel (Official Movie ),"May 26, 2025",5367,9373,0:17:23,19.45,,,,,,,,,,,,,,,,,,,,,9373,2717.4534,236,,116186,4.37
svPYMDJB6f4,A Nation Swift as the Eagle — Who Is Deuteronomy 28:49 About?,"Mar 27, 2025",40,9138,0:00:55,139.21,65.27,,,,,,,,,,,,,,,,,,,,16962,142.5966,60,,6659,3.08
0XrtYFN9Kr0,The Tribe of Reuben — Seminole Indians and Genesis 49,"Mar 31, 2025",56,7877,0:01:03,114.05,67.26,,,,,,,,,,,,,,,,,,,,16161,141.3655,53,,5472,3.38
JVB7mOU2AhI,The Seminole Indians Were Israelites — The Proof,"Apr 1, 2025",59,7548,0:01:21,137.66,71.11,,,,,,,,,,,,,,,,,,,,16369,171.6082,65,,3132,2.84
DEYNUT9uoxM,12 Tribes Of Israel what did the tribe of Judah do? #history @AIBIBLEGOSPELS,"Feb 21, 2025",34,7524,0:00:45,133.45,61.73,,,,,,,,,,,,,,,,,,,,8226,94.9232,45,,21101,3.19
isBUYL7jvdY,The Tribe of Gad — 300+ Native Nations Descend From Israel,"Apr 19, 2025",58,7199,0:01:28,153.32,71.91,,,,,,,,,,,,,,,,,,,,15570,178.979,65,,2200,2.41
8pMiLny_LOc,Aztecs and the Day of the Dead — Ancient Babylonian Connection,"Apr 15, 2025",56,6522,0:01:16,136.64,77.43,,,,,,,,,,,,,,,,,,,,12811,139.4167,60,,12492,6.31
m51Aex5Y6Aw,Who are the Scattered Hebrew Israelites in the Americas? #history #biblicalexploration #blackhistory,"Feb 13, 2025",51,5435,0:01:08,133.98,64.73,,,,,,,,,,,,,,,,,,,,5593,103.1797,46,,5617,4.79
JtHZygSmaH8,The Sorcerers Knew — Seminole Indians Were a Special People,"Apr 1, 2025",51,5224,0:01:07,132.36,67.78,,,,,,,,,,,,,,,,,,,,11466,99.0727,38,,4065,4.85
Ad3mUsbLL3w,The Chosen: 12 Tribes of Israel – Teaser Trailer,"Apr 12, 2025",68,4612,0:00:29,43.51,,,,,,,,,,,,,,,,,,,,,4612,37.9012,64,,10430,3.89
xMqnO931dic,The Tribe of Ephraim  What Hosea 9 Prophesied About Them,"May 7, 2025",50,4545,0:01:25,171.57,76.93,,,,,,,,,,,,,,,,,,,,9608,108.8749,45,,11705,7.22
f9RM-psiCu0,What Christ Really Looks Like — Revelation 1:14 Explained,"Apr 5, 2025",59,4388,0:01:27,148.56,73.12,,,,,,,,,,,,,,,,,,,,9407,107.5925,28,,3756,6.6
wlF2yDtDdfo,The Tribe of Gad — North American Indians in Genesis 49:19,"Apr 17, 2025",59,4129,0:01:17,130.63,72.24,,,,,,,,,,,,,,,,,,,,8621,89.0637,59,,2303,3.26
9H4yPDLobmw,The 10 Lost Tribes Crossed the Ocean to the Americas,"Mar 31, 2025",52,3982,0:01:06,127.64,70.17,,,,,,,,,,,,,,,,,,,,8274,74.1016,11,,1677,1.91
8sw0hlTmmaw,The 12 Tribes Came From Israel to the Americas — Not Bering Strait,"May 2, 2025",59,3827,0:01:09,117.21,68.4,,,,,,,,,,,,,,,,,,,,7839,74.2691,27,,3914,3.81
HiOEk8CogA8,The Seminole Indians Wore Priestly Garments of Israel,"Mar 31, 2025",56,3791,0:01:01,109.55,63.51,,,,,,,,,,,,,,,,,,,,8155,65.4722,15,,2604,2.61
VtwWyI_SQnc,The Tribe of Judah Built America — But Never Got the Credit,"Apr 6, 2025",58,3715,0:01:16,131.04,71.41,,,,,,,,,,,,,,,,,,,,7647,79.1628,23,,2589,1.97
cNj0lEfNFiA,God Will Save the Tribe of Judah First — Zechariah 12:7,"Apr 3, 2025",54,3645,0:01:29,165.19,73.54,,,,,,,,,,,,,,,,,,,,7684,90.861,21,,3557,5.9
mMkUmDuniVQ,Simeon and Levi — The Fierce Anger Prophesied in Genesis 49,"Apr 1, 2025",58,3552,0:01:27,151.18,66.75,,,,,,,,,,,,,,,,,,,,7853,87.3027,16,,2555,3.13
NAYa0kXwSwQ,The Tribe of Reuben — Nomadic Warriors the Europeans Feared,"Apr 1, 2025",57,3502,0:01:07,119.12,76.84,,,,,,,,,,,,,,,,,,,,6802,66.5165,16,,2218,2.89
0c45lrmSNCo,Why Kingship Belongs to the Tribe of Judah — Hebrews 7:14,"Apr 4, 2025",58,3500,0:01:33,161.55,73.74,,,,,,,,,,,,,,,,,,,,7417,91.6465,25,,4881,4.55
ry_PjMpdi8Q,The Tribe of Issachar — Aztecs and the Assyrian Captivity,"Apr 11, 2025",52,3470,0:00:58,112.58,69.57,,,,,,,,,,,,,,,,,,,,6714,57.0602,11,,2960,1.59
TZV8LKt-t5E,The Tribe of Gad Took the Best Land in the Americas,"Apr 22, 2025",52,3151,0:01:05,125.07,56.15,,,,,,,,,,,,,,,,,,,,7335,57.9292,21,,4628,3.03
XJYSaQ1fpxU,Biblical Curses That Changed World History FOREVER! #history #biblicalexploration #blackhistory,"Feb 11, 2025",41,3042,0:01:04,157.6,64.95,,,,,,,,,,,,,,,,,,,,3159,54.6241,41,,3279,3.14
L84JUXnMoR8,The Hidden Truth About The 12 Tribes of Israel REVEALED #history @AIBIBLEGOSPELS,"Feb 22, 2025",34,2981,0:00:58,171.09,60.73,,,,,,,,,,,,,,,,,,,,3067,48.1841,33,,3854,3.27
Zs2ctQoZmhU,The Prophecy revealed: Full Breakdown of the 12 Tribes of Israel  @AIBIBLEGOSPELS,"Feb 25, 2025",248,2835,0:01:51,44.99,,,,,,,,,,,,,,,,,,,,,2835,87.8655,63,,37836,4.46
jzhLtWD4Qtw,The Tribe of Issachar — The Mexicans and Genesis 49:14,"Apr 12, 2025",57,2760,0:00:56,99.33,78.31,,,,,,,,,,,,,,,,,,,,4918,43.7558,11,,1606,1.81
crLefjKVnVk,How to Identify the Real Israelites — Match the Curses,"Mar 24, 2025",55,2692,0:01:14,135.78,68.38,,,,,,,,,,,,,,,,,,,,3178,55.9143,16,,2237,1.88
nVOXmuAJPuY,The Tribe of Zebulun — Guatemalans to Panamanians Are Mayans,"Apr 7, 2025",58,2574,0:01:26,148.89,68.75,,,,,,,,,,,,,,,,,,,,5525,62.2135,13,,3100,2.39
-814ghiFIXg,Why the Aztecs Built Pyramids Like Ancient Egypt — Hosea 8:13,"Apr 14, 2025",60,2556,0:01:02,104.43,67.65,,,,,,,,,,,,,,,,,,,,4991,45.0801,7,,1667,3.12
TBNEIWRpnzI,The Tribe of Judah Will Rise — Ezekiel 37 and Revelation 11,"Apr 3, 2025",57,2543,0:01:16,134.92,67.97,,,,,,,,,,,,,,,,,,,,5512,54.8204,16,,4819,3.84
rq27Uvxudwg,Who and Where are the lost 12 Tribes of Israel today? #history #biblicalexploration #Blackhistory,"Feb 14, 2025",40,2488,0:00:59,148.86,64.07,,,,,,,,,,,,,,,,,,,,2887,41.2005,23,,7907,3.29
6rni7hocXVM,Puerto Rico's Precious Fruits Deuteronomy 33 Blessings,"May 15, 2025",56,2381,0:00:55,99.12,65.27,,,,,,,,,,,,,,,,,,,,4827,37.2277,9,,3634,6.44
bjjjgJR1wKY,The Curses of Deuteronomy 28 — Every One Has Been Fulfilled,"Mar 25, 2025",59,2375,0:01:07,114.72,65.54,,,,,,,,,,,,,,,,,,,,2758,44.7297,20,,1680,3.04
h7pYxWAEci0,Where the 10 Lost Tribes Went — 2 Esdras 13:39 Reveals All,"Mar 30, 2025",43,2317,0:00:54,127.82,62.23,,,,,,,,,,,,,,,,,,,,4014,35.6557,9,,3592,3.03
BfPot9X6Yyk,God Held the Euphrates River — The 10 Tribes Crossed Over,"Mar 31, 2025",49,2165,0:00:34,71.33,62.63,,,,,,,,,,,,,,,,,,,,3847,21.5154,10,,1861,1.72
8qjE34r7ISM,The Prophecy Revealed : They look like us #history #biblicalexploration #blackhistory,"Feb 12, 2025",39,2161,0:00:38,97.58,58.63,,,,,,,,,,,,,,,,,,,,2258,22.8584,10,,1840,3.48
yo48yhFzwaM,Lost Tribes of Israel Found Through Biblical Prophecies! #blackhistory @AIBIBLEGOSPELS,"Feb 12, 2025",44,2083,0:01:06,150.91,66.42,,,,,,,,,,,,,,,,,,,,2210,38.4286,11,,3540,2.54
9YpL3hEPQuY,The Tribe of Issachar Went Back Into Bondage — Hosea 8:13,"Apr 10, 2025",62,1954,0:01:17,124.56,63.63,,,,,,,,,,,,,,,,,,,,4249,42.4165,5,,2519,3.89
HS36EPP5zgc,The Israelites Left the Heathen and Came to the Americas,"Mar 31, 2025",53,1702,0:01:02,116.99,65.22,,,,,,,,,,,,,,,,,,,,3120,29.6149,7,,1849,1.57
LwPZQ-wPjnc,Ancient Mystery of Israel's Missing Tribes FINALLY Explained! #blackhistory @AIBIBLEGOSPELS,"Feb 6, 2025",51,1649,0:01:09,136.53,69.98,,,,,,,,,,,,,,,,,,,,1817,31.9164,9,,4936,2.78
MkoJO402Rmc,The Tribe of Judah — Sold by Africans and Arabs Into Slavery,"Apr 2, 2025",61,1632,0:01:28,144.55,73.8,,,,,,,,,,,,,,,,,,,,3447,40.2072,11,,3023,3.37
DXG-tql5TP8,The Most High Chosen “ How special we are” @AIBIBLEGOSPELS,"Mar 18, 2025",55,1620,0:00:51,93.03,66.72,,,,,,,,,,,,,,,,,,,,1713,23.0398,17,,1941,5
vEB569AEDwg,Simeon and Levi — Haiti and Dominican Republic Divided,"Apr 2, 2025",56,1583,0:00:56,100.54,69.74,,,,,,,,,,,,,,,,,,,,3120,25.0535,8,,1540,3.9
GrqhQqq8hCQ,Part 1 : The Prophecy revealed: Full Breakdown of the 12 Tribes of Israel  @AIBIBLEGOSPELS,"Mar 23, 2025",54,1504,0:01:12,134.78,60.25,,,,,,,,,,,,,,,,,,,,1961,30.4667,13,,1749,2.46
gK7bK1ktRR4,Ephraim vs Manasseh — Why Jacob Chose the Younger Brother,"May 1, 2025",56,1494,0:01:06,118.14,56.85,,,,,,,,,,,,,,,,,,,,3372,27.9276,9,,1856,2.8
wKtfQLOH9ww,The Hidden Truth About The Chosen People REVEALED @AIBIBLEGOSPELS,"Mar 17, 2025",54,1431,0:00:54,101.36,61.58,,,,,,,,,,,,,,,,,,,,1529,21.7685,3,,2283,3.2
UrZyd9pzI70,Zebulun and Issachar — Mayans and Aztecs in Deuteronomy 33,"Apr 13, 2025",62,1425,0:01:09,112.12,68.83,,,,,,,,,,,,,,,,,,,,2893,27.8081,2,,2571,1.52
O28keEFsM7I,They Said Shema Yisrael — Israelites Were in Puerto Rico,"May 4, 2025",54,1282,0:01:12,134.27,64.23,,,,,,,,,,,,,,,,,,,,2897,26.0653,6,,1172,3.84
5C2It2rF_CY,Why God Chose Israel — The Only Righteous Nation on Earth,"Mar 23, 2025",56,1274,0:01:04,114.31,63.19,,,,,,,,,,,,,,,,,,,,1371,22.6662,9,,1879,1.7
SWZId0P96f8,Zebulun and Issachar — Mayan and Aztec Places of Worship,"Apr 8, 2025",66,1241,0:01:04,97.08,72.14,,,,,,,,,,,,,,,,,,,,2346,22.3316,2,,1572,3.24
4vj5cDipimw,Scattered Among All Nations — Deuteronomy 28:64 Prophecy,"Mar 29, 2025",40,1235,0:00:34,85.19,48.7,,,,,,,,,,,,,,,,,,,,1695,11.7975,5,,3070,3.45
0bcCriDBO7w,The Tribe of Levi Adopted Voodoo — Malachi 2:9 Fulfilled,"Apr 2, 2025",57,1182,0:00:55,96.81,66.51,,,,,,,,,,,,,,,,,,,,2459,18.3465,6,,1795,1.39
9jiykCkltok,Simeon and Levi on Hispaniola Genesis 49:5 Prophecy,"Apr 2, 2025",66,1177,0:01:21,123.61,67.48,,,,,,,,,,,,,,,,,,,,2435,26.9259,6,,2554,5.29
OHfVqkni9g0,Smitten Before Their Enemies — Deuteronomy 28:25 Fulfilled,"Mar 25, 2025",45,1163,0:00:34,76.57,58.58,,,,,,,,,,,,,,,,,,,,1259,11.1506,3,,1365,1.68
WBTvL8yDu70,The Mystery Behind The 12 Lost Tribes of Israel REVEALED? #blackhistory @AIBIBLEGOSPELS,"Feb 7, 2025",39,1085,0:00:39,101.76,66.24,,,,,,,,,,,,,,,,,,,,1265,11.9854,7,,5475,2.25
Fw4kOZmriqs,What The Sacred Scriptures REALLY Tell Us About Salvation @AIBIBLEGOSPELS,"Mar 15, 2025",31,1049,0:00:33,108.24,45.69,,,,,,,,,,,,,,,,,,,,1134,9.7873,9,,1721,1.8
dHw41Z7hmVM,The Blessings of Joseph — Genesis 49:24 and the Mighty God,"Apr 28, 2025",57,1035,0:00:42,75.08,72.46,,,,,,,,,,,,,,,,,,,,1772,12.4924,5,,946,3.38
V-dUWFIYZQE,The Tribe of Naphtali — In the Southern Hemisphere by the Sea,"Apr 28, 2025",57,1003,0:01:28,155.82,70.09,,,,,,,,,,,,,,,,,,,,2059,24.9099,5,,1821,2.2
dpERIR0YZZ8,The Most Powerful Biblical Discovery They Kept SECRET! #blackhistory #History Deuteronomy 28:1-14,"Mar 5, 2025",326,987,0:01:44,32.02,,,,,,,,,,,,,,,,,,,,,987,28.6165,11,,11802,3.3
p3aXUpiFT2k,Jacob summon his son @AIBIBLEGOSPELS,"Mar 4, 2025",14,922,0:00:22,161,55.3,,,,,,,,,,,,,,,,,,,,1020,5.7857,7,,1462,2.19
StUObmgtTqw,The Tribe of Asher — Mighty Warriors With Buckler and Sword,"Apr 23, 2025",59,874,0:00:48,81.41,45.96,,,,,,,,,,,,,,,,,,,,2062,12.0148,2,,1591,3.96
KK4BaRSCneI,The Hidden Story Behind The 12 Tribes of Israel That Will Amaze You! #blackhistory @AIBIBLEGOSPELS,"Feb 7, 2025",56,845,0:00:51,92.4,69.63,,,,,,,,,,,,,,,,,,,,973,12.1724,9,,3322,2.86
B6vbnPpsX0Y,Ancient Biblical Mystery! #history #biblicalexploration #blackhistory @AIBIBLEGOSPELS,"Feb 2, 2025",59,806,0:01:07,114.95,51.2,,,,,,,,,,,,,,,,,,,,923,15.1925,5,,1463,4.92
bhXtvLHRkrU,They Built Houses But Could Not Live in Them — Deuteronomy 28,"Mar 25, 2025",56,775,0:00:47,84.41,62.1,,,,,,,,,,,,,,,,,,,,853,10.1857,3,,978,1.33
7f9Pk1Wwn5o,Top Archaeologist Shares Hidden Secrets of the 12 Tribes  #blackhistory @AIBIBLEGOSPELS,"Feb 2, 2025",48,752,0:01:07,140.85,33.6,,,,,,,,,,,,,,,,,,,,873,14.1427,3,,1316,2.28
_RxAAxLNQNU,They Went on Slave Ships — The Transatlantic Trade Was Prophecy,"Mar 29, 2025",55,743,0:00:51,93.95,76.95,,,,,,,,,,,,,,,,,,,,1148,10.7164,9,,1073,2.52
kPO91HQ5nU0,The Tribe of Ephraim in Puerto Rico — 6000 Indians Massacred,"May 10, 2025",62,741,0:01:02,100.04,68.75,,,,,,,,,,,,,,,,,,,,1305,12.9033,2,,748,3.74
A7cH3cIkFUg,The Tribe of Naphtali — From Chile to the South Sea Islands,"Apr 28, 2025",54,699,0:00:46,85.22,60.72,,,,,,,,,,,,,,,,,,,,1363,9.123,1,,1065,2.35
HQOGmykLvOw,Melanesians Were Enslaved — The Hidden Polynesian Slave Trade,"Apr 28, 2025",57,682,0:00:49,86.39,60.76,,,,,,,,,,,,,,,,,,,,1318,9.5108,4,,848,1.89
Ze1fd58FxNo,God's Plan Shifting Behind the Scenes #intheplan #faith,"Dec 21, 2025",85,680,0:00:50,59.17,54.07,,,,,,,,,,,,,,,,,,,,1355,9.7157,9,,373,1.34
0c_NdH8xMKs,The Most High’s Love For Israel A Heart To Heart,"Jul 21, 2025",66,626,0:00:33,50.24,30.49,,,,,,,,,,,,,,,,,,,,1985,6.3507,5,,629,3.02
Zydb5yxsPZo,Is This the Real History of Israel's Lost Tribes?,"Mar 14, 2025",117,597,0:01:23,71.12,,,,,,,,,,,,,,,,,,,,,597,13.7999,4,,6842,4.37
t627Mad1ljI,How to Spot False Prophets by Their True Fruits,"Aug 5, 2025",38,563,0:00:30,79.99,44.42,,,,,,,,,,,,,,,,,,,,1387,5.0515,6,,436,3.21
SIXOuwwXpzo,Why Israel Is Called So Holy They Must Follow,"Jul 18, 2025",57,550,0:00:35,61.86,51.41,,,,,,,,,,,,,,,,,,,,1115,5.6028,3,,324,2.47
BMHa1-aVF_4,Unveiling the Hidden Truth: Why the Apocrypha Was Removed from the Bible,"Sep 3, 2025",55,549,0:01:03,116.15,58.31,,,,,,,,,,,,,,,,,,,,1101,9.9121,2,,1697,3.54
K7JT9tQa_So,The Miraculous Healing of a Leper That Defied All Odds!,"Aug 3, 2025",34,542,0:00:24,72.15,38.2,,,,,,,,,,,,,,,,,,,,1507,4.0255,7,,286,1.4
dxFbCCS6k3U,Unveiling Rome's Hidden Symbolism and Bible Revisions That Changed History,"Sep 4, 2025",63,525,0:01:04,102.66,52.57,,,,,,,,,,,,,,,,,,,,1145,9.6378,5,,343,2.92
wZNMyr3ikxs,How The Most High Redeemed Israel A Story of love,"Jul 25, 2025",67,524,0:00:33,50.57,49.34,,,,,,,,,,,,,,,,,,,,1123,5.1437,3,,420,3.57
oYW3mgVLIfU,Who Are The Israelites Unpacking Their Divine,"Jul 19, 2025",63,524,0:00:48,76.38,53.53,,,,,,,,,,,,,,,,,,,,1089,7.2011,3,,687,2.47
jFSKLn20ecs,Why You Must Remove Your Own Flaws Before Judging Others,"Jul 28, 2025",26,519,0:01:21,312.12,24.7,,,,,,,,,,,,,,,,,,,,2002,12.307,0,,405,4.2
afwWega5ofA,The Prophecy of David's Righteous Branch Hope,"Jul 20, 2025",31,517,0:00:41,132.68,29.73,,,,,,,,,,,,,,,,,,,,1782,6.4261,10,,344,2.03
sxlj45oKFrc,Did Jesus Bring Peace or Division The Truth,"Jul 12, 2025",23,512,0:00:26,115.4,30.58,,,,,,,,,,,,,,,,,,,,1784,4.2588,3,,381,3.41
PCxBqyvr8NA,The Lost Tribes of Israel Blessings Deuteronomy 28:1-14 @AIBIBLEGOSPELS,"Mar 6, 2025",155,507,0:01:30,58.51,,,,,,,,,,,,,,,,,,,,,507,12.7732,7,,8985,2.74
ooFdPFS_qvs,"Christ’s True Mission Awakening Israel, Not EVERYONE AT FIRST","Jul 13, 2025",47,491,0:00:47,101.92,32.15,,,,,,,,,,,,,,,,,,,,1627,6.895,2,,805,2.61
TXa0EqXTjr0,The Call to Moses How The Most High Sent Israel,"Jul 23, 2025",62,490,0:00:54,87.74,42.55,,,,,,,,,,,,,,,,,,,,1261,7.6669,5,,327,2.75
FZS8WGcY6Wg,The Remnant of Israel What Romans 11 Reveals,"Jul 15, 2025",44,481,0:00:39,89.3,42.61,,,,,,,,,,,,,,,,,,,,1232,5.5392,2,,912,3.29
XuDLCMmWT6g,Why Did They Lock Away This Mysterious Painting?,"Sep 5, 2025",69,439,0:00:29,43.33,63.76,,,,,,,,,,,,,,,,,,,,747,3.7608,5,,303,1.65
NRUOZmX2NWg,Did Jesus Abolish the Law The Shocking Truth,"Jul 8, 2025",66,412,0:00:56,85.24,43.54,,,,,,,,,,,,,,,,,,,,1053,6.6353,2,,502,1.99
W8gbSwHzxKE,Top Ten Scriptures They Don’t Teach in Church,"Jun 27, 2025",257,404,0:01:57,45.77,,,,,,,,,,,,,,,,,,,,,404,13.1992,4,,7066,4.71
iILlk8mc0eM,"The Tribe of Benjamin — Beloved of the Lord, Deuteronomy 33:12","May 24, 2025",56,403,0:00:45,81.31,31.72,,,,,,,,,,,,,,,,,,,,1263,5.3987,1,,979,3.06
a4c8bJgxEuY,Understanding Christ Starts With Understanding Yourself,"Jun 3, 2025",16,403,0:00:27,169.62,38.32,,,,,,,,,,,,,,,,,,,,1223,3.2929,3,,1231,2.44
8aaTGPQmSXo,"The Tribe of Benjamin — A Light in the Darkness, Isaiah 9:2","May 24, 2025",66,395,0:00:55,83.82,66.78,,,,,,,,,,,,,,,,,,,,754,6.1818,2,,757,4.49
5Qo3io6MwEs,Why Did Rome Fear the King James Bible?,"Sep 3, 2025",67,384,0:00:48,72.33,54.82,,,,,,,,,,,,,,,,,,,,764,5.2959,4,,387,2.58
Mgp2CgZtG64,The Tribe of Naphtali — Goodly Words and a Fruitful Land,"May 16, 2025",55,383,0:00:44,80.93,65.23,,,,,,,,,,,,,,,,,,,,683,4.8198,0,,1001,6.49
Tf390YnbgRg,Israel's Return — The Dry Bones of Ezekiel 37 Live Again,"May 31, 2025",55,379,0:00:46,84.66,67.02,,,,,,,,,,,,,,,,,,,,727,4.9713,1,,1201,2.5
gVtjIGub94w,The Tribe of Manasseh — Separated From His Brothers,"May 18, 2025",51,376,0:00:37,74.31,60.29,,,,,,,,,,,,,,,,,,,,723,4.0708,1,,656,5.34
hJDgZIu3gas,The 12 Tribes Gathering — Prophecy of the Final Restoration,"Jun 1, 2025",53,370,0:00:32,61.08,57.48,,,,,,,,,,,,,,,,,,,,757,3.4601,3,,1036,1.93
5IHuhAx9184,The Tribe of Benjamin — Sons of the Right Hand Revealed,"May 24, 2025",62,367,0:00:47,75.95,65.05,,,,,,,,,,,,,,,,,,,,681,4.8794,5,,470,2.13
wjAAS108GDw,"The Tribe of Benjamin — Howling Through Music, Rising to Rule","May 24, 2025",58,358,0:00:35,62.04,45.82,,,,,,,,,,,,,,,,,,,,825,3.7412,1,,707,1.98
t898Bmt9Pzc,The Tribe of Asher — Royal Dainties and Hidden Blessings,"Apr 28, 2025",64,353,0:01:03,99.93,66.15,,,,,,,,,,,,,,,,,,,,690,6.3383,2,,994,2.41
MFTYh87UX00,The Most High Chosen People,"Jun 29, 2025",292,352,0:01:34,32.28,,,,,,,,,,,,,,,,,,,,,352,9.2156,6,,6073,4.76
Tg9tXQBBEVU,The Tribe of Manasseh — Half Tribe in a Foreign Land,"May 22, 2025",55,352,0:00:43,78.6,62.82,,,,,,,,,,,,,,,,,,,,690,4.3101,2,,598,3.85
thvQjWzAhJI,The 12 Tribes Awaken — The Prophecy of the Last Days,"Jun 2, 2025",54,349,0:00:57,106.54,60.53,,,,,,,,,,,,,,,,,,,,691,5.6698,2,,967,1.86
Jb9l1tT95ok,The Most High Chosen People Official Movie,"Jul 20, 2025",1117,348,0:03:44,20.12,,,,,,,,,,,,,,,,,,,,,348,21.7247,2,,7737,2.62
0hjJSaaUgpU,"The Tribe of Naphtali — A Hind Let Loose, Genesis 49:21","May 17, 2025",62,348,0:00:43,70.55,61.21,,,,,,,,,,,,,,,,,,,,668,4.312,0,,728,5.63
hb56WpRKlSk,The Tribe of Benjamin — Devouring the Prey at Dawn,"May 23, 2025",56,347,0:00:51,92.51,53.5,,,,,,,,,,,,,,,,,,,,717,5.1093,3,,624,2.08
RKJvtfG_JAI,Who Was Jesus Really Taking to?,"Jul 9, 2025",62,338,0:00:49,79.16,49.12,,,,,,,,,,,,,,,,,,,,815,4.7495,1,,327,4.28
hhUc8eF3fzQ,"The Tribe of Benjamin — Wolves in the Last Days, Genesis 49:27","May 24, 2025",63,337,0:01:04,102.29,49.71,,,,,,,,,,,,,,,,,,,,776,6.1665,1,,526,2.09
DCBxC0F0fBY,"The 144,000 Sealed — All 12 Tribes of Israel in Revelation 7","May 30, 2025",56,333,0:00:30,53.94,42.13,,,,,,,,,,,,,,,,,,,,776,2.968,0,,663,2.26
es3QtBndsRo,"What the 144,000 Actually Means: Full Breakdown #spiritualtruth #revelation","May 30, 2025",58,332,0:00:37,63.89,55.35,,,,,,,,,,,,,,,,,,,,680,3.5372,2,,511,3.33
TmTLdel9HhM,The Tribe of Manasseh — A Multitude of Nations Prophesied,"May 21, 2025",53,327,0:01:00,113.29,52.41,,,,,,,,,,,,,,,,,,,,737,5.58,4,,525,1.71
xL8v7eZ9mwc,The Prophecy Revealed AUDIO BOOK,"Jul 27, 2025",4426,327,0:07:25,10.06,,,,,,,,,,,,,,,,,,,,,327,40.4327,1,,12238,1.85
qUNz7fKwtMo,Why Black Nobility Matters in These Last Days,"Sep 13, 2025",184,326,0:01:10,38.48,,,,,,,,,,,,,,,,,,,,,326,6.4109,-1,,7140,3.67
zZ2JGBR8kdI,The Only True High Holy Days Of The Bible,"Jun 3, 2025",237,322,0:01:29,37.59,,,,,,,,,,,,,,,,,,,,,322,7.9685,1,,6522,3.65
DIvHY0Ic1Ac,The Complete Biblical Timeline Brought to Life With AI! @AIBIBLEGOSPELS,"Dec 27, 2024",347,322,0:02:26,42.27,,,,,,,,,,,,,,,,,,,,,322,13.1209,2,,3285,5.6
ly6H3WEF9GE,Matthew Chapter 3: Baptism @AIBIBLEGOSPELS,"Jan 19, 2025",163,321,0:01:38,60.17,,,,,,,,,,,,,,,,,,,,,321,8.7448,3,,2335,3.77
xb8pPrCgFo4,The Wise Man’s Secret to Building a Life That Withstands Any Storm!,"Aug 1, 2025",38,321,0:00:26,69.7,37.42,,,,,,,,,,,,,,,,,,,,849,2.5785,3,,575,2.26
ATRC-1-MzcY,The Centurion’s Unbelievable Faith That Amazed Jesus Himself!,"Aug 4, 2025",55,320,0:00:56,103.53,49.23,,,,,,,,,,,,,,,,,,,,798,5.1829,4,,376,2.39
KVbj6CvMX5c,Secrets Behind the King James Bible!,"Aug 31, 2025",802,317,0:02:34,19.28,,,,,,,,,,,,,,,,,,,,,317,13.6143,3,,6357,3.49
bE_dzZEE4uI,"Why Saying 'Lord, Lord' Isn’t Enough to Enter the Kingdom","Jul 30, 2025",28,314,0:00:27,99.06,29.26,,,,,,,,,,,,,,,,,,,,1117,2.707,3,,344,2.33
wei2jbfJMkk,Discover How Christ’s Word Cuts Through,"Jul 14, 2025",40,313,0:00:31,79.39,24.36,,,,,,,,,,,,,,,,,,,,1253,3.0921,0,,340,1.76
W0_WDcr0TFI,Ancient Black Hebrew Israelites Journey Through Sacred Wisdom! @AIBIBLEGOSPELS,"Mar 16, 2025",124,305,0:01:13,59.35,,,,,,,,,,,,,,,,,,,,,305,6.2345,1,,5786,2.7
KGVZHGopiQ0,Biblical Warnings That Came True Throughout History REVEALED Deuteronomy 28:15-68 @AIBIBLEGOSPELS,"Mar 9, 2025",768,292,0:05:43,44.71,,,,,,,,,,,,,,,,,,,,,292,27.8518,4,,3623,3.67
uGkJtkdElcg,The King James Revelation: Truth in These Last Days,"Sep 11, 2025",343,292,0:01:19,23.21,,,,,,,,,,,,,,,,,,,,,292,6.4585,1,,5963,4.16
dwd69b2G-gU,The Hidden Truth About Biblical Identity That Will SHOCK You! @AIBIBLEGOSPELS,"Feb 20, 2025",53,269,0:01:07,126.51,77.74,,,,,,,,,,,,,,,,,,,,339,5.0184,1,,1553,4.89
ocXSvMnJaLE,"The Lost Tribes of Israel Biblical Prophecy ""Deuteronomy"" 28:15-68 @AIBIBLEGOSPELS","Mar 8, 2025",688,263,0:04:40,40.75,,,,,,,,,,,,,,,,,,,,,263,20.4821,1,,3141,3.72
BmURiZOQnKA,Jesus Taught with Authority The Bold Doctrine,"Jul 10, 2025",58,259,0:01:06,114.33,48.53,,,,,,,,,,,,,,,,,,,,610,4.8623,2,,300,3
onnUvy4ryAA,The Awakening Has Begun | Scattered Tribes Reclaim Their Identity,"Jul 4, 2025",356,249,0:01:52,31.61,,,,,,,,,,,,,,,,,,,,,249,7.7842,0,,4452,4.54
gAgEL09nLRU,The Most High Is Restoring His Covenant—Here's the Proof,"Jul 6, 2025",311,234,0:01:43,33.37,,,,,,,,,,,,,,,,,,,,,234,6.7454,1,,4803,3.96
c9Lf2SBFjho,Matthew Chapter 1: The Genealogy @AIBIBLEGOSPELS,"Jan 4, 2025",234,228,0:02:19,59.78,,,,,,,,,,,,,,,,,,,,,228,8.8595,6,,1982,5.6
Fczcu80IHj8,The Secret History of Black Royalty and Faith!,"Sep 10, 2025",155,227,0:00:49,32.18,,,,,,,,,,,,,,,,,,,,,227,3.1455,4,,4198,4.84
ggAF28BvCqY,The Most High Chosen People How special and Holy they are @AIBIBLEGOSPELS,"Jan 21, 2025",33,223,0:00:28,85.41,,,,,,,,,,,,,,,,,,,,,223,1.7459,2,,3598,3.28
9L5mYYDAF1o,Did King James Really Change Britain Forever?,"Sep 2, 2025",204,221,0:00:58,28.78,,,,,,,,,,,,,,,,,,,,,221,3.6045,1,,4980,3.45
hJZ3g3ThGik,The Tribe of Judah — The Lion's Whelp Shall Rise Again,"Apr 3, 2025",52,221,0:01:33,179.73,72.2,,,,,,,,,,,,,,,,,,,,487,5.7675,3,,1400,2.07
quH9W0PDfKc,Jesus Calls His First Disciples After Conquering Temptation @AIBIBLEGOSPELS,"Jan 25, 2025",198,220,0:01:33,47.26,,,,,,,,,,,,,,,,,,,,,220,5.7185,3,,4315,2.8
EVXPdM8tGcQ,"The Tribe of Judah — Sold Into Slavery, Psalms 83 Conspiracy","Apr 3, 2025",59,212,0:01:20,136.8,70.88,,,,,,,,,,,,,,,,,,,,436,4.785,0,,1297,1.16
TxO-08eVvVw,Book of Matthew 6 #godsays #motivation #quotes #godscommand,"Mar 8, 2026",29,189,0:00:18,65.47,24.74,,,,,,,,,,,,,,,,,,,,740,1.2174,33,,26,0
TAGtH0QoXEQ,10 Biblical Prophecies You Never Heard About,"Jun 26, 2025",270,189,0:01:26,32,,,,,,,,,,,,,,,,,,,,,189,4.5356,0,,4531,3.31
0JMTqU5DhZQ,Why The World Was Made For The Children of Israel,"Jul 16, 2025",37,178,0:00:25,68.96,22.52,,,,,,,,,,,,,,,,,,,,727,1.4391,1,,928,3.77
vnKtQxSED6E,The Bible's Real Faces Revealed!,"Sep 8, 2025",56,175,0:00:41,74.04,38.93,,,,,,,,,,,,,,,,,,,,480,2.1101,4,,434,1.38
BRulDl0oKVM,The Hidden Message Our Elders Left Behind REVEALED @AIBIBLEGOSPELS,"Mar 11, 2025",71,170,0:00:49,69.62,,,,,,,,,,,,,,,,,,,,,170,2.3341,0,,3096,2.71
EvETIWMgMA4,Sleep With PSALMS | Power Scriptures for the Soul KJV Bible Audio,"Jun 5, 2025",7200,164,0:23:59,19.99,,,,,,,,,,,,,,,,,,,,,164,65.5635,2,,4553,2.9
V1X-iqGgYls,"Journey with us, The Most High Chosen People! @AIBIBLEGOSPELS","Mar 1, 2025",27,163,0:00:22,86.23,,,,,,,,,,,,,,,,,,,,,163,1.0152,1,,2463,2.72
g713EId0x3U,The Tribe of Dan — Judging His People as Prophesied,"Apr 18, 2025",58,159,0:01:54,197.11,77.05,,,,,,,,,,,,,,,,,,,,331,5.0646,1,,1310,3.82
cXlSgRzultU,Scripture Reveals Your True Tribe #israelite #identity #bibleprophecy,"Feb 28, 2026",19,159,0:00:14,77.39,20.95,,,,,,,,,,,,,,,,,,,,760,0.8697,2,,75,0
izvPfu1UjkM,The KJV 1611 Truth Nobody's Talking About,"Sep 12, 2025",289,159,0:01:21,28.08,,,,,,,,,,,,,,,,,,,,,159,3.5843,1,,3867,3.41
sN_UHGSkArg,Why These 12 Tribes Changed The World FOREVER @AIBIBLEGOSPELS,"Feb 18, 2025",58,153,0:01:07,115.9,60.96,,,,,,,,,,,,,,,,,,,,226,2.8699,0,,1079,2.97
WHElP5K1Wxo,Matthew Chapter 5: The Beatitudes,"Aug 3, 2025",370,150,0:01:37,26.33,,,,,,,,,,,,,,,,,,,,,150,4.0585,1,,3873,2.35
