3ase0yJE_Xs,The 12 Tribes of Israel The Most High Holy People @AIBIBLEGOSPELS,"Feb 20, 2025",59,150,0:01:06,115.02,63.39,,,,,,,,,,,,,,,,,,,,219,2.7977,2,,952,1.89
x-Dyek2bN98,King James United Three Kingdoms The Untold,"Sep 2, 2025",69,146,0:00:43,62.34,36.59,,,,,,,,,,,,,,,,,,,,393,1.8311,1,,450,1.78
FxBcgMI3Rcc,The 12 Tribes Prophecy | What the KJV Bible Actually Says #gospel #truth #history,"Feb 28, 2026",29,145,0:00:38,132.13,28.16,,,,,,,,,,,,,,,,,,,,547,1.6863,6,,183,2.19
LFad8UPQOew,Top 10 Evil Kings of Israel – Wickedness Exposed!,"Jun 10, 2025",236,145,0:01:28,37.55,,,,,,,,,,,,,,,,,,,,,145,3.5691,0,,3106,3.44
puRpiE4KtXQ,"Deuteronomy 7:6-7 – ""For thou art an holy people unto the LORD thy God @AIBIBLEGOSPELS","Mar 3, 2025",45,145,0:00:35,78.14,,,,,,,,,,,,,,,,,,,,,145,1.4163,1,,3578,1.79
PEoPYP_Bc7Q,"Matthew Chapter 2: The Journey of Faith, Prophecy, and Divine Intervention @AIBIBLEGOSPELS","Jan 21, 2025",231,144,0:02:30,65.12,,,,,,,,,,,,,,,,,,,,,144,6.0171,0,,3430,1.92
qyh745BNjw0,Top Ten Curses of Deuteronomy 28,"Jun 28, 2025",208,143,0:01:26,41.7,,,,,,,,,,,,,,,,,,,,,143,3.445,3,,4202,2.67
IqcXS2Xd290,Matthew 13  #motivation #godsays #quotes #godscommand,"Mar 9, 2026",58,138,0:00:46,79.61,48.25,,,,,,,,,,,,,,,,,,,,342,1.8362,3,,76,2.63
2oP2-iyMf20,The Curses Came True — Israel Scattered Across the Earth,"Mar 26, 2025",64,134,0:01:09,108.24,57.76,,,,,,,,,,,,,,,,,,,,227,2.5938,0,,995,0.9
ZnCssbJ2ndw,The REAL Truth About the 12 Tribes of Israel #jesus #scripture #enddays #gospel,"Feb 28, 2026",41,123,0:01:01,149.57,36.89,,,,,,,,,,,,,,,,,,,,371,2.1686,2,,161,4.35
XOAgFc78mJQ,How God Blessed Israel With Everything They Needed #Gospel #Faith,"Feb 28, 2026",35,122,0:00:19,55.33,16.16,,,,,,,,,,,,,,,,,,,,700,0.8609,4,,391,1.02
oKEFVFc7fe8,Most Powerful Psalms For Protection Scriptures,"Jul 14, 2025",7587,109,0:23:44,18.78,,,,,,,,,,,,,,,,,,,,,109,43.1342,2,,2090,3.44
Ox_dozHLaaM,The Hidden Truth About Biblical Identity That Will SHOCK You! @AIBIBLEGOSPELS,"Feb 20, 2025",53,104,0:00:41,78.46,,,,,,,,,,,,,,,,,,,,,104,1.2013,0,,1340,2.24
YRi0JZn2_lM,Top Ten Greatest Women in the Bible,"Jun 5, 2025",237,100,0:01:54,48.35,,,,,,,,,,,,,,,,,,,,,100,3.1829,1,,2264,2.83
2e_pe-3GpBI,The SHOCKING Reality of How Nations Fall From Within @AIBIBLEGOSPELS,"Mar 22, 2025",52,100,0:00:37,71.19,,,,,,,,,,,,,,,,,,,,,100,1.0283,0,,3080,2.08
Mo1wDJhH3d8,The Tribe of Ephraim — Fruitful in a Strange Land,"May 3, 2025",55,99,0:01:03,116.06,75.21,,,,,,,,,,,,,,,,,,,,211,1.7682,1,,713,4.63
uCGVZVqgZTw,The Prayer Every Parent Should Know #parenting #hebrew #faith,"Feb 28, 2026",40,98,0:00:23,59.28,31.01,,,,,,,,,,,,,,,,,,,,326,0.736,1,,75,1.33
p0xBHbtk7CI,Powerful Biblical Knowledge That Nobody Talks About #blackhistory @AIBIBLEGOSPELS,"Feb 24, 2025",55,98,0:00:45,82.96,,,,,,,,,,,,,,,,,,,,,98,1.2421,0,,1425,1.61
w8fXqQPM26o,The Tribe of Naphtali — Full of the Blessing of the Lord,"Apr 29, 2025",60,97,0:01:20,134.62,79.63,,,,,,,,,,,,,,,,,,,,192,2.185,1,,916,3.06
7PkG1upR3lM,They Hid What James Said About the Papacy #BibleProphecy #12Tribes #TruthRevealed,"Sep 16, 2025",61,96,0:00:42,69.3,39.53,,,,,,,,,,,,,,,,,,,,227,1.1729,1,,720,3.06
2mruvqERKQs,What Makes the King James Bible So Special?,"Sep 4, 2025",65,93,0:00:37,56.95,26.88,,,,,,,,,,,,,,,,,,,,328,1.042,0,,479,4.18
TK82X4dOE7w,"The Tribe of Naphtali — Satisfied With Favor, Deuteronomy 33","Apr 30, 2025",54,89,0:01:11,133.24,71.3,,,,,,,,,,,,,,,,,,,,208,1.7935,0,,941,2.44
SlVWjV3Gf2I,The 1747 Map of Africa – What They Don’t Want You to See,"Jun 29, 2025",66,88,0:00:42,64.63,,,,,,,,,,,,,,,,,,,,,88,1.0427,0,,1081,5.37
i8WDWCNarRE,This is Why Fathers Tell Their Sons About the Exodus #legacy #faith #gospel,"Feb 28, 2026",38,87,0:00:28,76.3,33.72,,,,,,,,,,,,,,,,,,,,264,0.7677,2,,67,0
YZOq2NBT3d8,"The Tribe of Asher — Dipping His Foot in Oil, Deuteronomy 33","Apr 26, 2025",60,86,0:01:54,190.68,70.87,,,,,,,,,,,,,,,,,,,,185,2.7447,0,,864,1.97
eVm9_23Ngkk,Jesus' Mission Was Family Focused,"Jul 11, 2025",69,85,0:00:48,70.62,41.92,,,,,,,,,,,,,,,,,,,,218,1.1868,2,,276,2.17
U9Odey7BrxE,The Tribe of Naphtali — Possess Thou the West and the South,"Apr 28, 2025",62,85,0:01:04,103.38,72.64,,,,,,,,,,,,,,,,,,,,170,1.5236,0,,899,1.45
QMIYjjqLa6c,Hidden History of a Black European King!,"Sep 6, 2025",61,85,0:00:48,79.82,21.33,,,,,,,,,,,,,,,,,,,,361,1.2254,1,,669,4.19
9U2SAur93KE,God's commandments will change your life forever #bible #jesus #transformation,"Feb 28, 2026",41,85,0:00:21,53.09,15.43,,,,,,,,,,,,,,,,,,,,506,0.6499,0,,46,2.17
xDlYp2yQIx8,"The Prayer of Manasses, King of Judah (Powerful Repentance Prayer | Apocrypha)","Feb 7, 2026",251,82,0:01:29,35.49,,,,,,,,,,,,,,,,,,,,,82,2.0293,1,,1436,4.25
msD6dQm9W6A,Top Ten Greatest Kings Israel,"Jun 12, 2025",212,81,0:01:41,48.06,,,,,,,,,,,,,,,,,,,,,81,2.2925,-1,,2242,2.77
Ef_0BOSXpIA,Israel A Chosen Generation and Royal Priest,"Jul 24, 2025",66,81,0:00:30,45.45,15.89,,,,,,,,,,,,,,,,,,,,449,0.7897,0,,617,2.76
zyS-Q2F_Hps,Who Are the 12 Tribes of Israel? | Ancient Truths Uncovered,"Jul 17, 2025",41,80,0:00:27,67.61,27.05,,,,,,,,,,,,,,,,,,,,279,0.686,0,,567,4.41
V-VSf1C2aTw,Matthew 7  #motivation #quotes #duet,"Mar 8, 2026",38,80,0:00:48,126.77,27.78,,,,,,,,,,,,,,,,,,,,291,1.1433,2,,27,3.7
0nM51QdNWLU,"The Tribe of Asher — His Bread Shall Be Fat, Genesis 49:20","Apr 24, 2025",65,79,0:01:05,100.07,71.28,,,,,,,,,,,,,,,,,,,,148,1.4414,1,,684,2.78
N9TfaMJAIik,"Don't Give for Glory, Give for God #SpiritualTruth #Faith","Mar 7, 2026",38,77,0:00:20,54.25,9.83,,,,,,,,,,,,,,,,,,,,670,0.6365,4,,31,0
8oQbY2_2wnY,Top Ten Evil Women In The Bible,"Jun 17, 2025",202,74,0:01:28,43.58,,,,,,,,,,,,,,,,,,,,,74,1.8096,0,,1251,3.84
4-lwx45nL1A,"The Tribe of Ephraim — Arrows Against the Enemy, Zechariah 9","May 6, 2025",56,71,0:01:05,116.37,76.14,,,,,,,,,,,,,,,,,,,,149,1.2916,1,,724,2.21
a11hrG9FSpI,The True Mission & Doctrine of Christ,"Jul 13, 2025",527,71,0:02:26,27.78,,,,,,,,,,,,,,,,,,,,,71,2.8873,0,,2642,1.63
8RmiO6jT-Co,Matthew 7  #motivation #godsays #quotes #godscommand,"Mar 8, 2026",36,69,0:00:22,63.39,30.26,,,,,,,,,,,,,,,,,,,,239,0.4972,7,,15,0
FfnfxlX1hmU,Matthew 8 #motivation #godsays #quotes #godscommand,"Mar 9, 2026",37,68,0:00:44,121.19,26.42,,,,,,,,,,,,,,,,,,,,275,0.9081,4,,43,4.65
5clbXshp6Ic,The Hidden Reason Israel's 12 Tribes Hold Divine Power #KingdomRevealed #Prophecy,"Jul 26, 2025",55,68,0:00:39,71.11,22.22,,,,,,,,,,,,,,,,,,,,256,0.8029,0,,717,3.77
CuNKO1aBdRM,The Tribe of Ephraim — Scattered but Never Forgotten,"May 9, 2025",60,67,0:00:56,93.71,79.22,,,,,,,,,,,,,,,,,,,,123,1.0527,2,,789,3.68
2BqkIPKqj_8,The 12 Apostles Decoded | What You Never Knew About Them,"Jun 25, 2025",204,66,0:01:10,34.41,,,,,,,,,,,,,,,,,,,,,66,1.2868,0,,1974,2.13
6lbjD5o_ulk,This 12 Tribes Prophecy Changes Everything #shorts #prophecy,"May 15, 2025",53,65,0:01:01,115.18,66.3,,,,,,,,,,,,,,,,,,,,133,1.1155,1,,513,3.12
NLjHNAFh2Ho,Fear Only the Lord—All Other Powers Are Powerless #jesus #godmessage #shorts,"Feb 28, 2026",22,62,0:00:14,65.8,13.1,,,,,,,,,,,,,,,,,,,,442,0.3781,3,,48,4.17
m2yANlfK0Io,Most Follow the Wide Gate Without Realizing It #warning #scripture,"Aug 2, 2025",20,61,0:00:39,197.89,19.43,,,,,,,,,,,,,,,,,,,,325,0.7551,0,,335,1.19
MUOhSe9WJ-I,Top 10 Fossils and the Bible,"Jun 24, 2025",227,61,0:01:13,32.47,,,,,,,,,,,,,,,,,,,,,61,1.2489,0,,2881,1.46
jky3Ju8SM3Y,Matthew 13  #motivation #godsays #quotes #love #hebrew,"Mar 10, 2026",65,54,0:00:37,57.46,24.77,,,,,,,,,,,,,,,,,,,,219,0.6149,0,,77,0
L3TmNiJJ4ZM,Top 10 Psalms of David That Will Inspire You Today,"Jun 19, 2025",310,50,0:01:42,33.09,,,,,,,,,,,,,,,,,,,,,50,1.4248,1,,1123,2.49
UVRG401MP0M,The Prayer of Azariah (Powerful Prayer in the Fiery Furnace | Apocrypha),"Feb 14, 2026",639,49,0:03:13,30.21,,,,,,,,,,,,,,,,,,,,,49,2.6272,0,,775,3.35
09RCHU1MW9Q,What Your Heavenly Father Actually Wants You to Receive #KJVTruth #Gospel #Wealth,"Jul 31, 2025",52,48,0:00:44,84.97,14.56,,,,,,,,,,,,,,,,,,,,311,0.6728,0,,317,1.58
ODXWf2EagfQ,The Forgotten Prayer of King Manasses (Apocrypha Scripture),"Feb 16, 2026",236,48,0:01:15,32.17,,,,,,,,,,,,,,,,,,,,,48,1.0124,0,,1465,1.98
VwLNSJuesG0,Jesus Confronts the Pharisees - Matthew 12's Battle for Truth & Righteousness,"Mar 13, 2026",546,47,0:01:17,14.16,,,,,,,,,,,,,,,,,,,,,47,1.0093,0,,1195,3.01
sgLo5OdT06k,The Grain Fields Confrontation - Jesus Breaks The Sabbath Law #KJVBible #Gospel,"Mar 12, 2026",50,46,0:00:21,42.7,15.03,,,,,,,,,,,,,,,,,,,,286,0.3589,1,,53,0
Z8z2MM1e2L8,What Happened to King James' Family?,"Sep 7, 2025",65,45,0:00:27,42.36,25.63,,,,,,,,,,,,,,,,,,,,141,0.3742,0,,455,2.64
wlRi_e-zzE4,The Tribe of Ephraim — A Watchman in the House of God,"May 13, 2025",56,45,0:00:46,82.75,68.85,,,,,,,,,,,,,,,,,,,,83,0.5881,0,,391,5.12
95TP7Geht98,"Thieves, Rust, and the Real Treasure #BibleWisdom #Revealed","Mar 8, 2026",24,42,0:00:13,57.03,15.91,,,,,,,,,,,,,,,,,,,,266,0.2346,3,,63,1.59
FEkLq5XApX0,The Everlasting Covenant Israel’s Promise,"Jul 22, 2025",40,40,0:02:01,303.51,17.92,,,,,,,,,,,,,,,,,,,,197,1.4065,0,,243,2.06
n7bbRBUSXfY,Jesus Heals on the Sabbath—What the Pharisees Got Wrong #BibleTruth #Jesus #Gospel,"Mar 13, 2026",41,39,0:00:17,43.22,16.39,,,,,,,,,,,,,,,,,,,,228,0.2594,2,,88,2.27
rKLtGlKw4ak,3 Things Jesus Commands Before You Enter His Kingdom,"Jul 17, 2025",667,37,0:03:00,27.07,,,,,,,,,,,,,,,,,,,,,37,1.8559,0,,770,2.6
ccPTvavU5uU,This Ancient Law Still Changes Everything Today #bible #faith #gospel,"Feb 28, 2026",26,37,0:00:18,69.29,21.39,,,,,,,,,,,,,,,,,,,,166,0.2341,7,,53,0
t4g80RwGtis,Matthew 13 KJV | The Hidden Mysteries Jesus Only Revealed to the Chosen,"Mar 9, 2026",439,35,0:02:08,29.35,,,,,,,,,,,,,,,,,,,,,35,1.2527,0,,727,3.99
xO5bu0thY28,Deuteronomy 6 | Hear O Israel – The Shema & Greatest Commandment (KJV),"Feb 28, 2026",299,32,0:02:13,44.76,,,,,,,,,,,,,,,,,,,,,32,1.1896,0,,681,2.79
QBMo8vJm1D0,Matthew 12 KJV | Lord of the Sabbath & The Unpardonable Sin,"Mar 8, 2026",468,32,0:02:19,29.81,,,,,,,,,,,,,,,,,,,,,32,1.2399,0,,493,5.48
s_BujKy3mjs,Matthew 7 #motivation #quotes #duet,"Mar 8, 2026",39,32,0:00:26,68.77,31.07,,,,,,,,,,,,,,,,,,,,115,0.2669,1,,15,0
zQaLpyUFfNA,Why Governments Fear Moral Truth #AIBibleGospels #12Tribes,"Sep 17, 2025",45,32,0:00:41,91.34,71.88,,,,,,,,,,,,,,,,,,,,58,0.37,0,,414,3.86
p8E7hz7Vtn4,Matthew 10 KJV | The Full Gospel in Cinematic Vision,"Mar 7, 2026",415,31,0:01:34,22.69,,,,,,,,,,,,,,,,,,,,,31,0.8107,0,,502,3.59
2jY6JD1f3Ak,Who Really Are the 12 Tribes of Israel Today #EndTimes #TruthRevealed,"Mar 14, 2026",66,30,0:00:32,49.99,16.39,,,,,,,,,,,,,,,,,,,,182,0.3209,0,,88,0
l0aQ6HURuS8,Matthew 7  #motivation #godsays #quotes  #money  #success,"Mar 8, 2026",37,24,0:00:26,70.67,17.91,,,,,,,,,,,,,,,,,,,,133,0.2093,0,,25,0
TMSy1bkK2tQ,Where Are the 12 Tribes NOW? #BibleMystery #EndTimes #Prophecy,"Mar 14, 2026",43,23,0:00:31,74.16,11.33,,,,,,,,,,,,,,,,,,,,191,0.256,0,,39,5.13
ggEaJVWsYMs,Jesus Showed His Power Through Radical Forgiveness #jesus #miracle #scripture,"Mar 14, 2026",46,23,0:00:20,44.49,8.58,,,,,,,,,,,,,,,,,,,,244,0.2038,0,,32,0
q91VkMp8tY8,Consider the Lilies of the Field #BibleTruth #Scripture,"Mar 7, 2026",15,22,0:00:18,123.23,10,,,,,,,,,,,,,,,,,,,,204,0.1736,3,,33,0
IDe8Ig3Rw1g,Matthew's Meal With Jesus Changed History #BibleStory #Gospel #Faith,"Mar 14, 2026",57,21,0:00:17,30.92,8.47,,,,,,,,,,,,,,,,,,,,235,0.1675,0,,32,3.13
_Ylc1IR0qTc,These Biblical Laws Will Transform Your Character #Discipline #Faith,"Feb 28, 2026",21,19,0:00:14,69.36,13.1,,,,,,,,,,,,,,,,,,,,135,0.1208,1,,34,2.94
5PkQelhrXaM,What the Bible Says About the 12 Tribes #IsraeliteAwakening #Scripture,"Feb 28, 2026",34,16,0:01:17,228.62,80,,,,,,,,,,,,,,,,,,,,37,0.3474,0,,64,1.56
mYbLS7to7iM,Who Inherited the Promise? The 12 Tribes of Israel #BibleProphecy #TruthRevealed,"Mar 16, 2026",79,14,0:00:30,39.18,20.9,,,,,,,,,,,,,,,,,,,,63,0.1346,,,19,5.26
3riiNCfzQ_g,They've Been Using the Same Deception for 2000 Years #Bible #GovernmentControl,"Sep 14, 2025",45,14,0:04:23,586.27,46.15,,,,,,,,,,,,,,,,,,,,37,1.0333,0,,424,1.89
NbxKHpWaJwY,Who Really Are the 12 Tribes of Israel Today? #ProphecyExplained #Israelite,"Mar 15, 2026",37,12,0:00:18,49.23,11.54,,,,,,,,,,,,,,,,,,,,113,0.0943,0,,74,0
QIwAL9K-bVI,The Family Jesus Chose Over His Own #Christianity #Scripture #SpiritualTruth,"Mar 15, 2026",58,12,0:00:19,32.93,25.58,,,,,,,,,,,,,,,,,,,,45,0.0739,0,,23,4.35
Psd0BoCOnKU,"Dead Girl Brought to Life, Blind Men See—How? #Scripture #Miracle #KingdomPower","Mar 15, 2026",47,5,0:00:12,26.67,10.42,,,,,,,,,,,,,,,,,,,,48,0.0316,0,,22,0
FPmOIuG-TIo,Why Did James Lose His Friends Over This Secret? @AIBIBLEGOSPELS,"Sep 9, 2025",140,5,0:01:04,46.22,,,,,,,,,,,,,,,,,,,,,5,0.0899,0,,143,2.1
 -grZ-uQ2U7w,Kingdom Prosperity AD,,75,5,0:00:59,79.66,,,,,,,,,,,,,,,,,,,,,5,0.083,0,,0,
o55RyJe0Lu4,Ancient Israel's Secret Identity Finally Revealed #IsraeliteAwakening #Gospel #History,,65,,,,,,,,,,,,,,,,,,,,,,,,,,,,1,0
q9W387FmpGE,Are You One of the 12 Tribes? Find Out Now #Israelite #Gospel,,27,,,,,,,,,,,,,,,,,,,,,,,,,,,,1,0
ZyVNYgM4aqo,The Trap of Human Traditions vs Divine Law #BibleStudy #Gospel #Shorts,,61,,,,,,,,,,,,,,,,,,,,,,,,,,,,1,0
L-tShzw6ONg,The Wayside Parable | What Jesus Said About Hearing But Not Understanding #gospel #jesus #scripture,,60,,,,,,,,,,,,,,,,,,,,,,,,,,,,1,0
kPUWXf-9xfo,Why Jesus Touched the Untouchable Woman #BibleLessons #Gospel #Faith,,45,,,,,,,,,,,,,,,,,,,,,,,,,,,,1,0
rGOlcOqpPOI,"Jesus, John, and the King's Terrible Mistake #BibleGospel #Uncovered",,61,,,,,,,,,,,,,,,,,,,,,,,,,,,,1,0
iMNr2Xilz8c,Ancient Israel's 12 Tribes | Where Are They Now? #BibleProphecy #Revelation,,64,,,,,,,,,,,,,,,,,,,,,,,,,,,,1,0
